"created_at","user_id","screen_name","status_id","full_text"
"Sat Dec 11 02:12:57 +0000 2021","726939781507125248","BradCongelio","1469490358719598592","Here's a look at QBs' completed air yards per attempt (dark green) vs. their intended air yards per attempt (light green). 

Garoppolo &amp; Ryan have the smallest spreads between the two while Goff, Hurts, Mahomes, and Rodgers are all vying for the largest spread. 

data: #nflverse https://t.co/IGtlhcsF7d"
"Sat Dec 11 15:24:00 +0000 2021","40782542","reinhurdler","1469689429702807555","The Steelers have received the most benefit from penalties on a net basis this season, while the Browns have been hurt the most from penalties.

Data: #nflverse https://t.co/5g1ac6gKyQ"
"Sat Dec 11 19:17:35 +0000 2021","29360193","davisj2007","1469748215478206467","Another crazy week so I didn't get a chance to post this, though I promise I ran the model prior to Thursday's game (I also didn't update the title, this is after week 13). What stands out to you? #nflverse https://t.co/2zq0HRlbTr https://t.co/KlnLR9GaKP"
"Sat Dec 11 19:17:37 +0000 2021","29360193","davisj2007","1469748222209974274","Week 13 was another positive week for model predictions - here is week 14!  I'm not proud of the @Vikings prediction for Thursday, because both teams deserved to lose #nflverse https://t.co/cUQTerHiPP"
