"created_at","user_id","screen_name","status_id","full_text"
"Thu Dec 01 03:18:48 +0000 2022","1103787522084257793","Doug_Analytics","1598154621138391041","New York Giants
Down &amp; Distance-to-Go Summary

Giants finding success in 2nd &amp; long and 3rd &amp; short

#nflverse

Please like this because it took me 8 hours to make https://t.co/5iqiWPQ7I1"
"Thu Dec 01 03:42:39 +0000 2022","726939781507125248","BradCongelio","1598160621081546752","I wanted to try replicating a recent #dataviz by @tanya_shapiro that required using 'ggbeeswarm' for plotting and the 'magick' package for headshot image manipulation.

Here are your current #NFL leaders in average air yards per attempt. #nflverse https://t.co/19zPW9mMP2"
"Thu Dec 01 14:10:32 +0000 2022","1205557554442575878","mrcaseb","1598318636351082496","As a follow-up, this time I determined the average point differential separately for wins and losses.
The sample size for some teams, e.g. the losing side of the Eagles or the winning side of the Texans, is quite small. But still some nice insights.
#nflverse https://t.co/DhGTR3yo0e https://t.co/NjBNFEqFdZ"
"Thu Dec 01 14:10:35 +0000 2022","1205557554442575878","mrcaseb","1598318647172382722","I did this especially because of the Ravens...
They better not lead with a TD or more at halftime
#nflverse https://t.co/GBwt7nDOUh"
