"created_at","user_id","screen_name","status_id","full_text"
"Mon Jan 03 13:53:16 +0000 2022","451578920","andreacasiragh1","1478001515956772864","This season I have seen so many offensive linemen score a touchdown. 
I've been trying to see for the past 20 years, and if there is no mistake with the label position, this is the most productive year for the big man!

#nflverse #nfl @MitchSchwartz71 https://t.co/5pLO8wfht7"
"Mon Jan 03 15:01:20 +0000 2022","935526760023777280","BrunoHMioto","1478018648535150598","Well, it was a great game!

Data: #nflverse https://t.co/ZJosO0E48P"
"Mon Jan 03 18:15:12 +0000 2022","358575395","SamHoppen","1478067435622342657","King of the Fourth, King of the Fourth! Despite an up-and-down season, Matthew Stafford leads all quarterbacks in fourth-quarter EPA (min. 100 dropbacks), while the AFC West is well represented in the top five. #nflverse https://t.co/fhQknTyrDN"
"Mon Jan 03 22:17:06 +0000 2022","1370449271540043776","_pranavrajaram","1478128312639754252","Robby Anderson has 101 targets this season but somehow just 469 receiving yards. He has also run the 7th most routes in the NFL.

His total receiving EPA is -27 (from #nflverse). No other player is below 0.

This is truly unbelievable stuff. https://t.co/5pvBP4xZAx"
